n12805218,美弗州第6县通过决议案 抵制中共强摘器官
n12863175,武汉协和医院一天四台心脏移植 供体引关注
n12878830,器官捐献协调员曝“自愿捐献”黑幕（上）
n12898622,器官协调员亲见 摘器官时供体在抽搐（下）
n12908242,美国总统之乡通过决议案 抵制中共强摘器官
n12932034,西方媒体为何鲜有报导中共强摘器官？
n12969218,沪警抢牙刷验DNA 多位法轮功学员遭采血
n13013820,活摘器官你真了解？来龙去脉图解一次看懂
n13024313,中共强摘器官 联合国十二专家“极震惊”
n13029839,论坛：加国会通过法案终止活摘器官迫在眉睫
n13052835,流亡医生：党要你去死 你就得去死
n13056521,美国威廉王县通过决议 抵制中共强摘器官
n13082457,破冰之战 揭开中共活摘器官罪的台前幕后
n13088279,国际宗教峰会专场：中共迫害法轮功加剧
n13119367,美国格林县通过决议 强烈谴责中共活摘器官
n13203445,意前议员揭中共活摘器官 赞法轮功拯救世界
n13245052,反活摘器官峰会吁各国立法 惩治中共暴行
n13253550,世界反活摘峰会 欧美亚医界谴责中共罪行
n13259127,证人指证 重庆当局重金阻挠活摘器官疑案调查
n13259730,“反活摘之世界宣言”吁全人类制止中共暴行
n13320919,美弗州爱塞克斯县决议案 谴责中共活摘器官
n13401416,前大陆外科医生揭器官移植黑幕
n13414467,林昶佐与NBA球星坎特对谈 推在台办人权峰会
n13430251,美英加议员拟立法 制裁打击中共活摘器官
n13656361,联合国场边会议将讨论制止中共活摘器官
n13719232,425周年之际 全球累积392万人举报江泽民
