n1250658,中国人的器官随要随得？
n1251925,中共官营黑店–无本万利的人体买卖
n1252638,沈阳知名医院有计划盗取骨髓曝光
n1253561,揭开大陆医院非法脏器移植的一角
n1254062,沈阳医大：境外华侨 10万可换肾
n1256610,中国移植器官来源成谜 更有人渣吃人体内脏
n1257301,西班牙媒体报导中共集中营正在发生着可怕的人体器官买卖
n1258154,适鸣：非法器官交易  中国大地在哭泣
n1258712,中国成移植和贩卖器官世界中心
n1259386,投书：大陆很早就利用人体器官进行实验及商业开发
n1259894,大陆医院﹕移植器官来自健康活体
n1262175,录像：广东卫视证实大陆医院违规换肾
n1264299,外国人到中国器官移植后死亡 多方质疑
n1265856,专访贝勒医学院教授：器官移植面面观
n1267981,徐水良：国内朋友谈中国大陆器官贩卖
n1268239,雅加达肾脏移殖说明会 不谈器官来源
n1268396,欲盖弥彰 中共出台器官移植管理规定
n1268398,中共忙推出器官法规 欲盖弥彰
n1269281,多伦多太阳报﹕出售 肝脏一个25000元
n1273352,停止推荐病人到中国做脏器移植
n1273024,追查国际：沈阳存在庞大活人器官库
n1276278,天津第一中心医院三月末大批器官移植
n1277729,马来西亚《中国报》专载美国调查中共活体摘器官
n1278041,追踪沈阳多器官移植中心的神秘器官来源
n1278214,外媒体 ：法轮功要求调查活体摘取器官
n1278225,关于一中心医院器官移植中心的一些情况
n1279174,加器官移植专家：这是对生命的亵渎
n1279442,二千五就可以买到肾
n1281727,王思明： 器官移植者的存活期
n1283215,林保华：请温家宝收购中国穷人的肾脏
n1283218,巴厘游行怵目 真人模拟非法器官移植
n1284608,肾源庞大 港集团式安排到粤换肾
n1285354,水星报﹕外国人到中国寻求死刑犯器官
n1285842,大批日本人去中国做器官移植
n1285925,中国再度否认摘取法轮功学员器官
n1287124,吉林市各大医院器官移植进入紧急状态
n1287255,港妇大陆换肾险变植物人
n1288040,郑州第七人民医院一天做过九例换肾手术
n1290629,法轮功挑头调查真相 医院移植器官忙
n1295588,调查海外器官移植 日本成立“国际伦理问题对应委员会”
n1296148,新文化报：吉大二院一天找到合适心脏
n1296652,器官移植成功后的苦难
n1297883,从大陆“器官移植”专利激增 看活体摘取器官
n1299020,时代：国际社会关切中国人体器官买卖
n1299932,器官移植中介：中国器官提供不会减
n1303042,比利时媒体报导中共盗卖人体器官
n1303279,湖南医院免费移植肝肾 法轮功冤情深
n1303322,欧委会动议案要求听证器官摘除事件
n1308469,【热点互动】西山会议看医疗改革
n1309947,生活新闻﹕证实中国器官移植来源
n1310386,调查线索:山东、广东、河北移植肝肾来源不明
n1310756,生活新闻﹕军医证实六万活摘器官案例
n1312251,莱西二级医院设肾移植 7/1前赶手术
n1313218,接上级指示 全军器官移植会紧急推迟
n1314366,全军器官移植会推迟 会务组证实原因
n1314970,晓辉：从医学论文看大陆器官移植
n1316914,总后政委孙大发视察器官移植所内幕
n1319606,山东盗取法轮功学员器官罪行严重
n1322039,大陆器官市场 公检法医一条龙作业
n1323217,48小时两次换肾身亡 肾来源引关注
n1323754,中国器官移植来源引起澳洲社会关注
n1325184,追查手术杀人，落实到个人
n1329371,假药引发肝肾移植 医生称做移植上瘾
n1330667,给军队医院打电话实录
n1331904,中共喉舌央视自曝器官移植疑点
n1331898,河南新乡盗器官谎称尸检 市长受株连
n1332878,在中国接受器官移植有感染与并发症之虞
n1333932,一天17台移植 长沙有器官调配中心？
n1344617,调查得知 锦州205医院将行32器官移植术
n1353379,今日美国﹕中共可移动的死刑车
n1356268,丹麦《政治报》：中国在贩卖囚犯器官
n1359397,免费换脸——中共喉舌又暴活体移植疑点
n1360042,美国患者前往中国寻求器官移植
n1360290,中共器官移植新规定 恐跳票
n1374179,读者来信﹕大纪元应当非常自豪
n1377310,加新民主党望总理对活摘器官采行动
n1377973,中国贩卖法轮功信徒器官
n1378146,大陆4万移植手术器官来源揭秘
n1378479,BBC：加律师称中国买卖法轮功学员器官
n1379207,法新社：调查指中共大规模摘取法轮功学员器官
n1379227,加国家邮报：政府计划调查活摘器官指控
n1379767,港前哨杂志刘达文支持独立小组调查报告
n1382190,加拿大环球邮报：可疑的41500例移植
n1387171,中共出台尸体管理新规定
n1387765,明明：谁盗卖了他们的器官？
n1389390,人权律师呼吁中国结束强行摘取器官
n1391479,【世事关心】“地球上未曾见过的邪恶”
n1392601,【热点互动】加国报告揭中共活摘人体器官暴行（二）
n1394193,加独立调查员华府揭中共活摘器官暴行
n1396831,首届世界器官移植大会波士顿开幕
n1397702,投书：狐狸尾巴露出来了，中国器官捐赠才21例，共捐献器官88个
n1400453,组图﹕法轮功在波士顿抗议活摘器官
n1400660,人体器官移植–生命之救星还是劫难？
n1401097,医学专家:美国人海外器官移植风险大
n1401358,澳政府关注中共活摘器官
n1401861,中西医生看器官移植 突显道德分歧
n1402758,世界器官移植协会关注活摘器官指控
n1402976,全球器官移植市场大买卖
n1404555,比利时电视台：中共被指控贩卖器官
n1407112,时事经纬 第36集－横河：学术研讨、伦理医德和屠杀暴行
n1409815,《澳洲人》报：“器官移植外交”
n1415652,一位学者就活摘法轮功学员器官的声明
n1416763,【热点互动】器官移植与医学伦理
n1418961,无法否认活摘器官事实　中使馆公开承认了什么？
n1419294,上海近期严厉打压法轮功  百余人被抓捕
n1419317,复旦大学附属医院6个月摘换6颗心脏
n1433156,乔高:新发现 天津医院85%器官卖往海外
n1448011,欧加政要墨尔本揭中共活摘器官问答
n1447200,瑞典政要及媒体关注中共活摘器官
n1461955,中共摘取死刑犯器官不符国际规范
n1463399,现代中国的酷刑滥用于法轮功修炼者群体
n1462902,“秋决”成中国器官移植医院牟利高峰期
n1467604,透视“国际移植网络支援中心”网站
n1472593,瑞典国家电视台报导中国人体器官出售
n1472701,台湾病人到中国进行器官移植受人权人士关切
n1475307,【热点互动】全球关注中共贩卖器官
n1488000,专家力谏：政府广宣赴中器官移植具风险
n1495281,上海移植界黑幕 拿正常人作实验致死
n1507252,中国医疗品质差 20名马国病人前往求医死亡
n1507307,日本电视报导在中国脏器移植的危险性
n1508314,日富士电视：在中国脏器移植的危险性
n1519211,中国器官移植问题多　中市卫生局医界关注
n1526276,英媒: 北京承认“器官移植旅游业”存在
n1527102,洛杉矶时报：中共承认摘取死刑犯器官
n1527735,人权组织促中共公布摘取器官详情
n1531361,中共认摘取器官 被指耍手段
n1531939,大陆医院仍招募海外器官移植患者
n1533992,为保奥运 中共借死刑犯转移活摘指控
n1534861,为卖一肾处决多囚 中共盗卖器官新证据
n1546751,比利时媒体报导针对中共器官贩卖的调查
n1546753,比利时报纸《Gazet van Antwerpen》报导中共活摘器官
n1551786,再曝东方医院人工心脏干细胞移植黑幕
n1558282,新加坡海峡时报：新加坡人以四万元买中国的肾脏
n1559633,深圳医院黑心手术 为夫献肝夫亡妻丢肾
n1574406,调查：到中国移植器官 染上肝炎者多
n1589477,毛群安受访BBC 回避活摘器官关键证据
n1593302,赴中移植肾肝 换回爱滋败血
n1595203,深圳地区移植器官来源异常
n1655990,中共出台移植条例 自曝活摘青少年器官
n1701643,吉林男子：我姐夫移植了法轮功学员的肝
n1706401,联合国报告公布中共活体摘除法轮功学员器官
n1712665,中共活摘器官 悉尼市长吁外长采取行动
n1725426,投书：活体摘除器官的又一例证
n1735267,纽约州议会举办研讨会 聚焦中共活摘器官
n1738112,澳法轮功呼吁将中共盗卖器官纳入APEC议程
n1781182,高峰：活摘法轮功学员器官再添新证
n1784129,环球邮报: 中国摘取器官牟利的致命计划
n1794808,路透社:发展中国家人体器官非法买卖
n1794820,以色列逮捕中国人体器官中介
n1813618,中共官员透露中共活摘器官移植内幕
n1814143,世卫确认全球五大器官走私热点
n1837927,中国器官交易与迫害法轮功黑幕
n1858487,中国医生签署不摘犯人器官协议
n1866043,外电：奥运促北京慌忙应对非法器官指控
n1871351,日男子中国买卖人体器官被捕
n1877528,中国医师违法在台湾揽客换肝
n1883531,中国医师赴台中介器官移植
n1883741,天津医师来台揽客 中国移植现况露底
n1895692,武警广东总院：器官供体分配系统仍运作
n1904419,德检察院调查非法器官交易
n1904776,外电：印度和中国包藏祸心的器官买卖
n1964198,外电：澳洲人海外移植器官大多来自中国
n2013449,女子车祸送院 死后眼角膜不翼而飞
n2013820,福州一患者医院去世　眼角膜不翼而飞
n2069767,张宇洁：卫生部副部长与中共互相利用
n2078803,济南小伙捐角膜无门 器官来自捐献有诈
n2182433,回应联合国要求交代器官来源 中共撒谎
n2460728,强摘器官焚尸灭迹 国际曝光川当局恐惧
n2471134,华裔妇女赴大陆换肾 被骗百万难讨说法
n2477996,中共死刑车 强摘死囚器官变卖
n2479217,美器官移植伦理会 著名专家吁停止培训中国医生
n2479592,唐恩：谈中共死刑车与活摘器官
n2491203,玉清心：清明时节你该为谁哭泣？
n2494445,玉清心：警惕中共扩大内需的器官移植生意
n2511800,移植大国半遮半露的实像
n2638156,德人权组织  将器官贩卖负责人送上法庭
n2639204,王华：请不要假装不知道
n2644150,中国发生医生涉案的“杀人盗器官”案
n2659349,器官何来 首度有医生因杀人摘器官被拘
n2717871,甄钧：解放军总后勤部是活摘器官核心机构
n2747981,法国国会内《血腥的器官摘取》介绍会
n2748626,麦塔斯：澳洲民众在逐渐了解事实真相
n2752136,欧阳非等：“死刑犯”撑不起中国器官移植市场上的蘑菇云(一)
n2752942,欧阳非等：“死刑犯”撑不起中国器官移植市场上的蘑菇云(二)
n2753824,热点互动直播预告：目击者披露活摘法轮功学员心脏惨案
n2754897,欧阳非等：“死刑犯”撑不起中国器官移植市场上的蘑菇云(三)
n2756001,欧阳非等：“死刑犯”撑不起中国器官移植市场上的蘑菇云(四)
n2757437,欧阳非等：“死刑犯”撑不起中国器官移植市场上的蘑菇云(五)
n2757808,目击者披露活摘法轮功学员心脏惨案(2)
n2758791,目击者披露活摘法轮功学员心脏惨案(3)
n2762782,唐彦：台湾要顾里子也要顾面子
n2778354,玉清心：从傅彪的两次肝移植说起
n2859334,解密谷歌被迫执行屏蔽词档案：活摘器官
n2881569,【新纪元周刊】揭开活摘器官黑幕
n2889956,华盛顿时报：中国庞大的人体器官交易
n2899245,大陆媒体曝光器官黑市 学者称勿掩中共罪恶
n2919016,老久：从工程院院士的跳楼看中共活摘器官的黑幕
n2928903,麦塔斯四年调查  中共骚扰不断
n3122194,拒绝到中国去的器官移植专家
n3168093,山西男子反悔卖肾 遭禁锢强迫做手术
n3232398,生取活人肾 媒体揭秘大陆器官买卖猖獗
n3436589,参与大陆器官秘密交易 3名韩国人被捕
n3440424,大卫‧麦塔斯：中国器官移植供体的来源（一）
n3640894,【刘晓】：党媒报导德国器官移植丑闻反揭中共罪恶
n3641410,【热点互动】中共活摘器官 惊爆美国政坛(2)
n3643941,横河：专家如何看中国的器官移植
n3653543,薄谷开来杀人案背后隐藏江泽民周永康
n3689263,中国媒体证实官方与黑道中介组庞大活体器官贩卖网络
n3691146,大纪元总编辑郭君在联合国人权大会指控中共活摘器官
n3691529,瑞士国会议员致函联合国：严惩活摘器官首恶
n3695364,【夏小强】：为何微博解禁王立军交美领馆密件内容？
n3698589,106位美国会议员联名要求国务院公布中共活摘器官罪行
n3699424,丹麦议员就中共活摘罪行 提请政府关注
n3700899,秋尚：10万补贴藏阴谋
n3702693,国际关注引恐慌 卫生部新规证实器官来源不明
n3703889,美国国会中国人权报告:活摘法轮功学员器官指控不断
n3704578,这些大陆民众为何愿意签名营救大法弟子？
n3705271,探秘大连金石滩“人体标本”展览与薄熙来
n3705875,法轮功致函奥巴马罗姆尼 吁公开关注中共活摘器官
n3707619,【内幕】薄熙来案中的江泽民（上）
n3712918,为器官杀人：中国的秘密器官移植生意
n3714793,美国市长：这些器官是哪来的？
n3721387,国际关注活摘器官 中共恐慌 逐步停用死刑犯作器官移植
n3725484,违法器官交易 术后成本台湾全民健保买单
n3725714,麦高：十八大开幕日 媒体惊现“活摘器官”信息
n3727058,【陈思敏】：网络聚焦18大的另一个热点
n3691204,上海女经理柏根娣：我差点被活摘器官
n3734642,中共活体摘取法轮功学员器官报告（十五）
n3740673,追查国际：关于塑化人体标本尸体来源调查报告
n3741520,台立院决议 境外器官移植需术后登录
n3742325,威廉王子到访剑桥 三次接制止活摘器官呼吁信
n3742514,非法器官移植猖獗 中共借黑市掩盖政府参与罪行
n3743155,独立调查员：澳洲政府应带头制止“器官移植旅行”
n3748091,2500名台湾医师反活摘 连署书送联合国人权高专
n3755884,德国医疗数据统计专家四年调研证活摘
n3750759,美中关系急待重塑 副总统拜登3接涉薄熙来案指控
n3775790,访台大陆医师疑涉活摘 立委要求说清器官来源
n3785792,巨幅制止中共活摘广告震撼加拿大能源之都
n3789474,欧议会举办中共信仰迫害听证会 直指活摘器官
n3790372,欧议员和学者谈中共对信仰团体的残酷迫害
n3801567,重庆医大一院涉嫌活摘7名法轮功学员器官
n3812312,澳洲绿党议员推重刑惩罚非法器官贸易
n3815477,中共卫生部副部长黄洁夫器官大会上落泪的真实原因
n3815576,欧洲议会副主席访美:联合美国和全球清算中共人权恶棍
n3825309,专访悉尼大学Singh教授 国家掠夺器官与澳洲立法
n3826499,专访大卫 ‧乔高：尊重人民意愿 立即停止迫害
n3827039,澳洲参议员：“真、善、忍”国际美展很美
n3829465,德国亲共媒体突然刊发中共活摘器官买卖事件
n3833972,杨景端：法轮功学员是活摘罪恶受害者
n3835965,德媒爆中共“依订单杀人”取器官 黑幕震惊世界
n3836751,世界器官移植之都逾万人签名 阻中共活摘
n3829889,掩藏在伪造“中国死刑犯器官证书”背后的黑幕
n3847407,马三家酷刑黑幕发酵 304军医院及法院器官案曝光
n3864064,媒体的道义　民众的良知
n3920374,法国国会举行新书《国家器官》发布会
n3927254,北京肾移植者：器官来自年轻法轮功学员
n3945594,审薄前武汉爆出地下卖肾黑车间 活摘器官再成焦点
n3947264,中共活摘器官罪曝光 国际大事记 （二）
n3951589,薄案审结后幼童遭挖眼活摘案曝光 眼角膜炒到30万
n3953994,【投书】“山西大老板”盗卖器官血腥链条
n3958663,组图：旧金山民众声援281号议案
n3990663,暴徒五次袭击伦敦中国城的活摘征签点
n4010178,DAFOH在威尔士国民议会举办活摘器官说明会
n4022811,悉尼国际器官移植会 专家谴责中共强取或活摘器官
n4112847,中共前卫生副部长再泄“活摘器官”重大信息
n4117289,大赦国际：全球死刑激增 中国仍是执行死刑大国
n4206955,欧洲理事会颁公约反对人体器官贩运
n4208797,胡锦涛同学遗孀指证中共前副部长黄洁夫惊人罪行
n4217414,中共连续网攻大纪元 阻华人了解活摘真相
n4223606,中共自曝器官黑市 难掩大规模活摘黑幕
n4234963,王立军专利上热词榜 杀人专利添活摘新证据
n4237977,江泽民入医院 百度开放敏感词“江泽民 摘器官”
n4247094,海伍德遭薄谷开来毒杀  敏感期其母再索赔
n4272052,四中全会前  陆媒介绍江泽民最恐惧的反人类罪
n4285231,医生直接杀人 杭州器官大会27医生被追查
n4290800,中共军医院器官移植“奇迹”引国际关注
n4304920,281号决议案吁制止中共活摘  南加民众征签
n4333732,否认到停用死囚器官 中共不断改口后的杀人秘密
n4442363,澳洲墨尔本集会揭中共活摘罪恶 民众震惊
n4448892,浙江捐器官宣誓作秀 中共不断改口器官来源
n4452039,德国多家媒体报导中国的死囚器官交易
n4459399,张德江被追问周永康是否供出江泽民
n4460115,江泽民活摘器官罪在丹麦大选前传播
n4452051,追查国际关于中共活摘法轮功学员器官证据专辑
n4461791,美国会发起343号决议案 制止中共活摘器官
n4470744,澳洲电台专访麦塔斯 揭中共活摘器官罪恶
n4486565,媒体报导 澳纽省小镇居民签名呼吁制止活摘
n4500956,中共胁阻澳洲官员参加器官交易论坛 议员驳斥
n4501792,澳纽省上议员：议员必须在议会讨论人权问题
n4540333,中领馆试图遮挡敏感信息 习近平访美天天见
n4546026,三军医大学政委换人 军队清洗或触江核心罪
n4546805,美国会报告：中共继续迫害法轮功等团体
n4570714,英国医学期刊：中共继续强摘死刑犯器官
n4574969,美国会播放《活摘》揭中共器官移植暴行
n4579773,谷开来离奇谋杀案 牵出惊天黑幕
n4586160,医生爆料：台湾癌患快速获大陆21岁活人全肝
n4585678,周永康和中国器官移植量暴涨之谜
n4586533,中共前卫生部副部长因器官问题被“摆上台”
n4581810,中共军事化活摘人体器官黑幕
n4616305,玉清心：冯小刚出演《老炮儿》怀念傅彪
n7466824,【网文】目击沈阳看守所一死囚被活摘前
n7475354,亚太眼科年会 国际医疗权威关注中共活摘器官
n7549652,“追查国际”：八百大陆医院涉嫌活摘器官
n7556248,中共器官移植黑幕在TEDx大会上曝光
n7564967,警察踢伤腰 让她逃过被活摘器官一劫
n7950836,山东矿业高管遭重刑 警察威胁活摘其妻器官
n8007879,英国医学期刊：《中国可怕的秘密移植》
n8021833,中共强摘人体器官最新报告将在美国华府发布
n8026568,最新报告：中共强摘器官数量惊人
n8030186,李祥春国会作证：中共为器官移植按需杀人
n8030824,南京警察强制采血 疑涉活体器官库
n8032342,美国国会听证聚焦“中共活摘器官”
n8042519,CTV：中共杀戮囚犯 强摘器官
n8042467,证人指证 法轮功学员徐真遭活摘器官死亡
n8045559,外媒密集报导中共秘密大量强摘器官
n8046198,美联社：决议案通过 要求停摘良心犯器官
n8050176,独立调查员欧洲议会提交中共活摘最新报告
n8049855,美议员：当立法禁止前往中国“器官旅游”
n8053644,VOA连线：英国议会举行中国器官移植听证会
n8056920,《外交家》：什么诠释反人类罪？活摘人器官
n8057168,英国《独立报》：中共仍在强摘良心犯器官
n8057176,组图：消失了的大陆器官移植网站
n8054054,死刑犯为何撑不起中国器官移植的蘑菇云
n8068303,关键评论网：中国的器官移植滥用恶化
n8068738,阿联酋《海湾时报》：中共强迫囚犯捐献器官
n8075865,《新欧洲》：中共被控强摘法轮功学员器官
n8076384,原唐山市工人医院护士曝光活摘器官线索
n8072936,收红色资金？国际器官移植协会前主席被问责
n8076759,外媒： 中共依然强摘囚犯器官
n8083042,中国器官移植的迷思：一人接受多次移植手术
n8088871,解放军第309医院每年做多少器官移植手术？
n8133146,陆媒曝大陆四线城市医院一日十例肾移植
n8136020,马来西亚中文媒体大篇幅报道《活摘》
n8149409,奥地利最大报纸网络版曝光中共活摘器官暴行
n8149447,法国《费加罗报》大篇幅披露中共活摘器官
n8153463,一位站在美国国会山前的中国女士的心愿
n8154543,香港器官移植大会在即 国际社会担忧
n8159920,加媒：大街小巷都有中共活摘罪行被曝光
n8169303,参加香港器官移植大会的中国医生被控杀人
n8181725,网曝“肝衰竭”患者上海华山医院当天肝移植
n8192057,军队反腐“风暴眼” 总后勤军改下续被整肃
n8200756,赵存贵被山西监狱迫害致死 疑被活摘器官
n8200702,追查国际：参加港器官移植会的53人涉活摘器官
n8220188,涉违规 郑树森论文遭国际器官移植大会拒绝
n8223226,组图：10年全球行动 制止中共活摘器官（1）
n8223370,组图：世界政府机构曝光中共活摘器官罪恶
n8226266,生物伦理网站：对中共强摘器官的批评白热化
n8226498,美议员质疑国际移植专家跟中共存利益关系
n8229198,黄洁夫感受压力快闪 叶启发被问活摘暴怒
n8233830,英国逾万人反活摘签名 促首相发声声援
n8237191,亲历者曝天津东方器官移植中心“黑箱内幕”
n8284422,加拿大世界小姐：中共在按需活摘人体器官
n8291404,玉清心：大陆游客说一个邻居换过二个肝
n8292951,北京死刑复核研讨会上 教授捅破中共杀人机密
n8315455,澳洲新闻网：中共盗取人体器官的现实
n8318478,澳洲新闻集团：中共摘取人体器官的现实
n8324315,李克强赴联合国 纽约人关注法轮功反迫害
n8366076,瑞典《医生报》：产业化的大规模反人类罪
n8398398,丹麦《贝林报》专题报导中共活摘器官罪行
n8400111,新西兰汽车之旅揭露中共活摘器官罪行
n8405888,丹麦电台：中国器官移植供体到底从哪来？
n8409585,黄洁夫为何承认一武警医院涉非法器官移植？
n8497143,武警公布停止有偿服务 含375个医疗项目
n8555518,【专访】罗宇揭央视掩盖中共强摘器官罪
n8565782,是谁打开了“潘多拉的盒子”？
n8616245,天津驻军8成有偿服务叫停 含数百敏感项目
n8794315,国际专家谴责黄洁夫说谎欺骗世界
n8859024,著名智库：中共大规模强摘法轮功学员器官
n8892363,黄洁夫两会谈器官移植 专家指其漂白自己
n9021123,平和中的震撼：致我们心中的善
n9031367,维也纳市议会决议案反对中共非法器官交易
n9612326,国际器官捐献大会 法轮功揭中共活摘罪行
n9612816,中共干扰加州参议院第10号决议案 外界谴责
n9717616,辛子陵：周永康欲立功狱中揭江曾新罪证
n9850223,人体器官转运“绿色通道”在掩盖什么？
n9856357,“与恶魔的交易” 中共器官移植旅游怪圈
n10211874,芬兰《患者医学杂志》刊文关注活摘器官罪行
n10266487,继众院后 乔州参院通过决议谴责中共强摘器官
n10282721,亚利桑那州议会签署制止中共强摘器官备忘录
n10318181,著名人权律师常青藤宾大揭中共活摘暴行
n10410921,密苏里州参院全票通过决议 谴责中共强摘器官
n10442407,麦塔斯揭中共经营器官黑市及活摘暴行
n10572869,黄洁夫央视炒作死囚器官 泄中共更多黑幕
n11279521,西方专家揭中共强摘器官罪行：取器官杀人
n11280869,谴责中共活摘器官 美密苏里州通过决议案
n11335935,BBC访活摘器官医生：被洗脑后无罪恶感
n11346364,英独立法庭证实中共活摘器官 韩媒争相报导
n11367315,【专访】英人权专家吁各国立法 清算中共
n11538883,欧洲移植大会 中共掠夺器官再成焦点
n11545564,法国修订“生物伦理法”抵制中共器官贩卖
n11547913,纽约论坛 活摘器官受害家属曝中共可怕行径
n11574020,荷兰媒体揭露中共活摘器官罪行
n11594995,河北命案 死者生前遭看守所频繁抽血
n11597772,法国解放报：法国应该承诺反对强摘器官
n11669316,福布斯：掩盖活摘器官 中共伪造器官捐赠数据
n12150824,疫情重灾区武汉和苏家屯 有一惊人相似点
n12249199,中共三桶油华尔街圈钱 背后黑幕鲜为人知
n12326366,10天4颗心脏 中共器官按需供给引忧
n12338586,37沙特人天津移植器官 牵出内幕知多少
n12350295,中共610官员坐镇 给上海法轮功学员采血
n12352363,中共为何强行火化他们的遗体（10）
n12371027,上海警察给法轮功学员采血“是国家规定”
n12443204,美报告：以行动应对中共侵犯人权一切行径
n12448233,美国会报告 要求对中共强摘器官采取行动
n12627668,美国会参众议员发起制止中共强摘器官法案
n12652921,美欧专家：让欧洲结束对中共的幻想
n12678074,中共最高法院院长周强涉多少人命案？
n12691724,华人实名揭露活摘器官 追查国际：中共是魔鬼
n12721290,美弗州县级决议案 谴责中共强摘人体器官
n12785954,一部捷克漫画作品将聚焦中共强摘器官
n12785715,美弗州劳登县通过决议案 声援法轮功
n12803746,移植名家臧运金跳楼亡 其“青岛模式”受关注
